{
  "schema": "harbor-live-v1",
  "source": "save",
  "updatedAt": "2026-09-14T00:00:00.000Z",
  "game": "anno-1800",
  "quests": [],
  "telemetry": {
    "buildings": [
      { "id": "farmer-house", "name": "Farmer Residence", "count": 8 },
      { "id": "lumberjack", "name": "Lumberjacks Hut", "count": 2 },
      { "id": "sawmill", "name": "Sawmill", "count": 1 },
      { "id": "warehouse", "name": "Warehouse", "count": 3 },
      { "id": "pub", "name": "Pub", "count": 1 }
    ]
  }
}
